{
  "schema": "akas.benchmark-run.v1",
  "id": "20261015234710246076-a75a5c18",
  "started_at": "2026-10-15T23:47:10.246076Z",
  "completed_at": "2026-10-16T00:00:44.801003Z",
  "status": "budget_exhausted",
  "source": {
    "revision": "3e90ad81dc812a17acc17e0acda34ca3b69ee3b8",
    "dirty": true,
    "tree_sha256": "0b85cd888e417e2bf9da99c10e56d41b4a5ac0c9258fa6458af16ac57b754c4e",
    "files": {
      "MANIFEST.in": "8ae8b16a92b023dbf19648660ce8cf6a3ec82469a2f5ccf7875129ba1396fc5e",
      "examples/graphs/residual/config.py": "62db23515fac60c8331c3de4f7029e301eb6a97d887b7ec8c082360a5cbdccd2",
      "examples/graphs/residual/graph.py": "878b884a5c50e0adf0d2b6c4dde0c38338880f783e42227a9f4c48c438ab81ed",
      "examples/graphs/residual/weights.py": "7f74f78b2cc6445c6581778e817894a9ffa3f4c2fea2560ef47ea251f09afd58",
      "examples/models/bigram/README.md": "2eaa8b0b24ff0c787602cc6778bbc04962085582b10b7a3e160ddbe544b45514",
      "examples/models/bigram/__init__.py": "7a1da2aade770d8a862f54586346281ad32b3352b740bc3edbc0d34894bde2f2",
      "examples/models/bigram/config.py": "2c78e5c29bad123e81f39bb737a9e950c037d9a916df1eab6ef2266c950da622",
      "examples/models/bigram/model.py": "235b2c42f55cecf08ac347ad231751ee9f41447c5e9d3768d163b156d1554ee2",
      "examples/models/bigram/weights.py": "16f66835b08f8ad64f56639095d05dfa4c247353b5323df46742565358a45fa4",
      "pyproject.toml": "e9f59e28a4d1301a7641865b61355384413aefb9aa3a4e114b781920dd28f32d",
      "src/akas/__init__.py": "1569d3614ee277b90447daf275a734adfba0b07f4ae519e03cad5cc1454f2f57",
      "src/akas/__main__.py": "afaa46660428fe963d5eb4120d1170cfb3ee63af67bbc22a2b1ce2ae4304c422",
      "src/akas/artifacts/__init__.py": "d2655b8f0c591dcb4e7af614fb20056cfc93eae32e5a3f7b19ba97bd5830ac1c",
      "src/akas/artifacts/fingerprint.py": "d3818b59b132d6a093bb210b916e757031b4f4c7620007e3ab8a9faed34114d4",
      "src/akas/artifacts/read.py": "f44f3c6ccb9c8da53877278a9fa589912516ae1db6a1488dab06acbab4db7e0e",
      "src/akas/artifacts/schema.py": "7c92b944820291e1f95d9d4464d89684e0185c92b32e6ae0b149125b46b42ae1",
      "src/akas/artifacts/write.py": "ac513618894bf244b611c51ee0c66cfea9e9b769d6584269b482b44631e4de50",
      "src/akas/benchmarking/README.md": "5501226e7cac5ad40dc15c4eb9002588b06f8ce356e8b02d788cbd490fdf58d6",
      "src/akas/benchmarking/__init__.py": "c2b94f6e05c7b49e02726393cd4e1100c8568191fb60c2efe6d0dcda10527812",
      "src/akas/benchmarking/cases.py": "6730ec0ad2623f13b0417f705b6b819531a49eb9472390a56147fd4bbd01ec01",
      "src/akas/benchmarking/history.py": "7c82d6811ad05eb983b6015e480f7f9f93b5e838ef11c2be0cded1f7ae00e22f",
      "src/akas/benchmarking/replay.py": "e9efdbdb7416eb7b12e37dde87ce1600620c0493157c961dba568a8ed915becf",
      "src/akas/benchmarking/report.py": "63dfa379a3a516e67efc91ad4ccf0c4afa35f4b247920b3131f7655903c57269",
      "src/akas/benchmarking/research.py": "4036e78340c2fb76bd891df2538269c60ac81854766a1bfbf3d902c8addfe01c",
      "src/akas/benchmarking/runner.py": "9aac0d6406cf1c9b27266b455ebe532fc4e6a2882e51c7e43d14dd1792b0a439",
      "src/akas/benchmarking/session.py": "be63ce593fd813c31b6d818cd5626ad88bef94faf8b0749c46c072b513d7384a",
      "src/akas/benchmarking/workload.py": "d26af106aacf60e72808b0a63566b30ed65e406c1438998df5b4fd9b11a35dc0",
      "src/akas/benchmarking/workloads/standard-v1.json": "c0096be8906c3d00e94c03bcddcbeb0e868112df5be1dd07d4ebc6e2eb1a7ef7",
      "src/akas/checkpoints/__init__.py": "e3b0c44298fc1c149afbf4c8996fb92427ae41e4649b934ca495991b7852b855",
      "src/akas/checkpoints/gguf.py": "8e1ddceab63e3c11dbe90054cade19f65bc2592bc126439c29501cd106af474f",
      "src/akas/checkpoints/partition.py": "644f942b391800982e595fd94635ceb3bbe7a3fe02481caaaa22fd0b5568ff0e",
      "src/akas/checkpoints/safetensors.py": "e9c493541faf8be53abb4431f12ccb10556624b647dc8be0a0286ba0c2dfef7e",
      "src/akas/checkpoints/upload.py": "2b69ddb387476a0335579282cf60d38e750df172d791d2b80244f746372a022f",
      "src/akas/cli.py": "749482c63465b24978fce118ad317b8c257017cb3d91d89eba893b305aac8d33",
      "src/akas/compilation/README.md": "71081e8f56dae488090c1de56e06bc9c78d4f26f77f94327549f9696f8fe1559",
      "src/akas/compilation/__init__.py": "652e0e6fd750d1c779a02a918f80bca4de1c5b1a1959dafcd7d78e583c5239b9",
      "src/akas/compilation/buffers.py": "240ffe915424dbd43cee9eef913d04f8cc6b37712d0c0984d70b816ccaa024aa",
      "src/akas/compilation/compile.py": "2cc20d0e00a46f8430843f9cf36d1b34beaf36298286032ad61233f589ee7292",
      "src/akas/compilation/emit.py": "9e5236b0f3194c94d77acf069a8a11b3e06d5669a93c70608cadcc28b456520a",
      "src/akas/compilation/liveness.py": "0cd53011b7df0f30f5ed27150e1cda1b04aaede4b5beb6dabc34e9140f67967c",
      "src/akas/compilation/paths.py": "d3a1ff2adeb2cb74581ff7cd0a66555b17f706dc4e11431c727c9fb241b7a0f2",
      "src/akas/compilation/phases.py": "7af6f74f78d651af5bc539518c9bdeac7944a762dcdb8e610fbca77adfa3de84",
      "src/akas/compilation/policy.py": "cb21274a40b11987943831877c72545b1e193775ced5e43604bc57aa1d4d2070",
      "src/akas/compilation/quantization.py": "cfe0b06ddc53772abcb14138cb14d3746ac9fe5f891172eb3bed9d8075347758",
      "src/akas/compilation/rewrites.py": "704fd8fc31ef55834a9db086d9192c50cbdf7ed1482360716622f1f164610caa",
      "src/akas/compilation/selection.py": "df2c60929827d04c4cca42eae9aa97abf9d07377e45197c0357e5dd99cefd0ea",
      "src/akas/compilation/state.py": "c5c99aa7730145789d6eb21859228188dd0adf3f9c7a6528b2c1ac52d3621761",
      "src/akas/compilation/transforms/__init__.py": "e3b0c44298fc1c149afbf4c8996fb92427ae41e4649b934ca495991b7852b855",
      "src/akas/compilation/transforms/projection.py": "e5d2a3ccb8e3b3096fd6aa0c7961a19b833856b93d1a6c5281c2496b7de51de1",
      "src/akas/compilation/transforms/state.py": "787c8f35d61b61716de754a7617721f002c0ac9a88a5dfb4f34225c0fc15a907",
      "src/akas/compilation/tuning.py": "af1000b7fb0f2e1969969d378563c5be7866de5eadcedc278ddd45a5aab8f510",
      "src/akas/compilation/validate.py": "1988d1b48268b280f8a477382d2b51259613d287616b8224731f3f7ff498e81a",
      "src/akas/config.py": "f57954ed24b433eeb37b9442dca6a591c7f445c458bd4f5a726035c7fe9a936e",
      "src/akas/engine.py": "ce916fffe689147ec209feae9c4fef15436c66db3540a8b5cb3d0d5dff70c615",
      "src/akas/execution/README.md": "9af7224ef0717515e9843bc8f927ae5c237a114a053e2d9b4c54a1a88298bd8a",
      "src/akas/execution/__init__.py": "583149b81c2fb616257fbffaa86b2026a07c2ed162a2b901d520d00337ec7b73",
      "src/akas/execution/batch.py": "fbc915543bb9afbd57e1548e7c176caea478b5b216e7eedcfcf0d234ace67e58",
      "src/akas/execution/executor.py": "5c42bdfc837f7e79c4707e1218284d07a03b7a7568a1085cede6191297a9eae0",
      "src/akas/execution/forward.py": "eca20e6b5230e0a35f43fa0c0d313ef395d003fc5590ddf04b7e41f8ee15f0ee",
      "src/akas/execution/plan.py": "00c4fe776d87647aff5ad05db2fe629c3b354f5ec190b67d9f295379d0454364",
      "src/akas/execution/replay.py": "2c4e7fe25a359f3044456aa9eeaafb09bb810de55bc27b9cd8401a557996684d",
      "src/akas/execution/state.py": "3a8288d16a6f612c39b4fd36b773242f49a48a8242c1f1498dda190949711c45",
      "src/akas/execution/workspace.py": "e6117c13dd77d90fe1b580c358cc910f3b44b85aaf598727ea1b1d5739f0cab7",
      "src/akas/generation/__init__.py": "81cfd7d65de72eb35388cb127be8d4fbf38f67970367916977909c55721b6203",
      "src/akas/generation/greedy.py": "f5dfd1f1f1407ac6bc4a31d2a8548693ee482fe5ce8438c4b750e210c9385025",
      "src/akas/generation/lookup.py": "bc3a9a578cc13bee515bc3f27a7af19583fab9fbad0f216a322b9655d0dd034f",
      "src/akas/generation/speculative/__init__.py": "9c5fcdf05634516db25c6c50cd6fe75566d8bf0ec40284881d98bf79093bc019",
      "src/akas/generation/speculative/acceptance.py": "bf2d4b1ca9c907267f6e30b20cf9f1ba49614eab9c94c1a67069992224f750b1",
      "src/akas/generation/speculative/decoding.py": "093efd08cf8dce6ed234909e42abb9ff682c4d9778adaf5a6078c8c7913bdfe6",
      "src/akas/generation/speculative/proposer.py": "78eec09bae0733d08f423041780f4e1030badb014bc9d8625415be20d6e5b90a",
      "src/akas/graph.py": "3dba8ac54a3f66d7085cc18741f91e6db51c07284c0c2029d189e1d89dec365f",
      "src/akas/kernels/README.md": "304af6cd561d8207004a58e9614aeb875450e97b5dc86b047971580eab5b77da",
      "src/akas/kernels/__init__.py": "e67ee0293767eb96ac3de37098e216161ec3dc914e5b763d968fc333480f0cc7",
      "src/akas/kernels/contracts.py": "f695a0d40c0cdf52db8c0e062bf6915d93581163421218d69a3cc4726eb051fc",
      "src/akas/kernels/definition.py": "3e769b138f3ca954bd841020087aec3ff36a34ec299f3d1eb3793fbef76c004d",
      "src/akas/kernels/kernel.py": "d93633376ad79915c2c68af47423acbfbda53fada88039dc089bd1e414080903",
      "src/akas/kernels/reductions.py": "359fc36b38ce1acef3cac9f953ea041a32e501d773e046bb5e50b459cf38c7b4",
      "src/akas/kernels/registry.py": "0f59c7c2ce608904bcd33f3d7366d2310734ef1dcfb94708fd90035e24da6595",
      "src/akas/kernels/webgpu.py": "7cd6248dc8b9f2b0a70bde32194a4c99a781de1301845b0b95ef4cb18e548b5b",
      "src/akas/memory/__init__.py": "8ede71a398174c6506204ee45f547b61b0cca3fc9e9f7dda59da235d0ed49ce2",
      "src/akas/memory/estimates.py": "92466642678c4b8e8a19feb6f1590af24ade18382214843f04e2ca4bd214454d",
      "src/akas/memory/layouts.py": "f104af0c1a70661584d7bdc782d7c59cd5282f589f4d1025a2243245c407e12f",
      "src/akas/memory/state.py": "435198681a76f5bdd2088930c2e0bbf6ad30193d8b3d8fc263eb9f2f4ac6c4b8",
      "src/akas/memory/transfer.py": "b477d53281cec5ad04e6f08b05b7941e817e80cfe9a4c4203159c8f729993414",
      "src/akas/models/README.md": "56a896fdb65e1cc8a716e8ccafd82336792dbf792bef28c9f91973399e2c52e4",
      "src/akas/models/__init__.py": "f2eee00dd21fa556f312b1b976bb7d0e67ad27eacee93eaf36b79dae9e91a527",
      "src/akas/models/blocks.py": "9ee87e21e60f4745481d02919d65d55adf2ef7ba59f0d9406c7a378e52aeedde",
      "src/akas/models/contracts.py": "69a1dc3376ad8cf431fbc9b0880c66fe5d9f4919b24183d40ac8a4b0459c0ce5",